{
  "generatedFrom": {
    "cleanupLedger": "manifests/cleanup-ledger.json",
    "digestReviewDecisions": "manifests/digest-review-decisions.json",
    "discoveredPrimitives": "manifests/discovered-primitives.json",
    "runtimeActivationApprovals": "manifests/runtime-activation-approvals.json",
    "sourceReviewDecisions": "manifests/source-review-decisions.json",
    "sourceRootDecisions": "manifests/source-root-decisions.json",
    "sourceRoots": "manifests/source-roots.json",
    "type": "SOURCE_ROOT_RETIREMENT_INPUTS"
  },
  "roots": [
    {
      "approvalSummary": {
        "alreadyActive": 2,
        "blocked": 0,
        "dependencyMapped": 0,
        "readyForApproval": 0,
        "readyForManualImport": 0,
        "reviewRequired": 0,
        "type": "SOURCE_ROOT_APPROVAL_SUMMARY"
      },
      "cleanupSummary": {
        "approved": 0,
        "executed": 0,
        "proposed": 0,
        "type": "SOURCE_ROOT_CLEANUP_SUMMARY"
      },
      "decisionSummary": {
        "digestCoveredByCanonical": 0,
        "digestRetainedExternal": 0,
        "rootPromoteCandidates": 0,
        "rootRetainedExternal": 0,
        "rootReviewRequired": 0,
        "sourceCoveredByCanonical": 29,
        "sourceKeepCanonical": 2,
        "sourceRetainedExternal": 0,
        "type": "SOURCE_ROOT_DECISION_SUMMARY"
      },
      "evidence": [
        "manifests/discovered-primitives.json records entries for sourceRoot intelligence.",
        "manifests/source-review-decisions.json and manifests/digest-review-decisions.json record covered=29 and retained=0 review groups.",
        "manifests/cleanup-ledger.json and manifests/runtime-activation-approvals.json record proposed=0, executed=0, readyForApproval=0, reviewRequired=0, dependencyMapped=0."
      ],
      "nextAction": "Keep this repository as the source of truth; expose primitives only through referential plugins and approved runtime links.",
      "observedEntries": 54,
      "resolvedPath": "/Users/amichne/code/intelligence",
      "retirementState": "CANONICAL_OWNER",
      "role": "canonical-candidate",
      "sourcePath": ".",
      "sourceRoot": "intelligence",
      "type": "SOURCE_ROOT_RETIREMENT_ENTRY"
    },
    {
      "approvalSummary": {
        "alreadyActive": 1,
        "blocked": 0,
        "dependencyMapped": 0,
        "readyForApproval": 0,
        "readyForManualImport": 0,
        "reviewRequired": 0,
        "type": "SOURCE_ROOT_APPROVAL_SUMMARY"
      },
      "cleanupSummary": {
        "approved": 0,
        "executed": 4,
        "proposed": 0,
        "type": "SOURCE_ROOT_CLEANUP_SUMMARY"
      },
      "decisionSummary": {
        "digestCoveredByCanonical": 0,
        "digestRetainedExternal": 0,
        "rootPromoteCandidates": 0,
        "rootRetainedExternal": 0,
        "rootReviewRequired": 0,
        "sourceCoveredByCanonical": 0,
        "sourceKeepCanonical": 0,
        "sourceRetainedExternal": 0,
        "type": "SOURCE_ROOT_DECISION_SUMMARY"
      },
      "evidence": [
        "manifests/discovered-primitives.json records entries for sourceRoot claude-agents.",
        "manifests/source-review-decisions.json and manifests/digest-review-decisions.json record covered=0 and retained=0 review groups.",
        "manifests/cleanup-ledger.json and manifests/runtime-activation-approvals.json record proposed=0, executed=4, readyForApproval=0, reviewRequired=0, dependencyMapped=0."
      ],
      "nextAction": "Keep the cleanup ledger as the source of truth for completed cleanup and rerun inventory to detect drift.",
      "observedEntries": 6,
      "resolvedPath": "/Users/amichne/.claude/agents",
      "retirementState": "CLEANUP_RECORDED",
      "role": "runtime-source",
      "sourcePath": "~/.claude/agents",
      "sourceRoot": "claude-agents",
      "type": "SOURCE_ROOT_RETIREMENT_ENTRY"
    },
    {
      "approvalSummary": {
        "alreadyActive": 0,
        "blocked": 0,
        "dependencyMapped": 0,
        "readyForApproval": 0,
        "readyForManualImport": 0,
        "reviewRequired": 0,
        "type": "SOURCE_ROOT_APPROVAL_SUMMARY"
      },
      "cleanupSummary": {
        "approved": 0,
        "executed": 5,
        "proposed": 0,
        "type": "SOURCE_ROOT_CLEANUP_SUMMARY"
      },
      "decisionSummary": {
        "digestCoveredByCanonical": 0,
        "digestRetainedExternal": 0,
        "rootPromoteCandidates": 0,
        "rootRetainedExternal": 0,
        "rootReviewRequired": 0,
        "sourceCoveredByCanonical": 5,
        "sourceKeepCanonical": 0,
        "sourceRetainedExternal": 0,
        "type": "SOURCE_ROOT_DECISION_SUMMARY"
      },
      "evidence": [
        "manifests/discovered-primitives.json records entries for sourceRoot examplar-agents.",
        "manifests/source-review-decisions.json and manifests/digest-review-decisions.json record covered=5 and retained=0 review groups.",
        "manifests/cleanup-ledger.json and manifests/runtime-activation-approvals.json record proposed=0, executed=5, readyForApproval=0, reviewRequired=0, dependencyMapped=0."
      ],
      "nextAction": "Decide whether this covered source should stay as provenance or receive a cleanup-ledger replacement proposal.",
      "observedEntries": 5,
      "resolvedPath": "/Users/amichne/code/examplar/agents",
      "retirementState": "COVERED_NO_REPLACEMENT_PLAN",
      "role": "local-repo-source",
      "sourcePath": "../examplar/agents",
      "sourceRoot": "examplar-agents",
      "type": "SOURCE_ROOT_RETIREMENT_ENTRY"
    },
    {
      "approvalSummary": {
        "alreadyActive": 0,
        "blocked": 0,
        "dependencyMapped": 0,
        "readyForApproval": 0,
        "readyForManualImport": 0,
        "reviewRequired": 0,
        "type": "SOURCE_ROOT_APPROVAL_SUMMARY"
      },
      "cleanupSummary": {
        "approved": 0,
        "executed": 1,
        "proposed": 0,
        "type": "SOURCE_ROOT_CLEANUP_SUMMARY"
      },
      "decisionSummary": {
        "digestCoveredByCanonical": 0,
        "digestRetainedExternal": 0,
        "rootPromoteCandidates": 0,
        "rootRetainedExternal": 0,
        "rootReviewRequired": 0,
        "sourceCoveredByCanonical": 1,
        "sourceKeepCanonical": 0,
        "sourceRetainedExternal": 0,
        "type": "SOURCE_ROOT_DECISION_SUMMARY"
      },
      "evidence": [
        "manifests/discovered-primitives.json records entries for sourceRoot examplar-hooks.",
        "manifests/source-review-decisions.json and manifests/digest-review-decisions.json record covered=1 and retained=0 review groups.",
        "manifests/cleanup-ledger.json and manifests/runtime-activation-approvals.json record proposed=0, executed=1, readyForApproval=0, reviewRequired=0, dependencyMapped=0."
      ],
      "nextAction": "Decide whether this covered source should stay as provenance or receive a cleanup-ledger replacement proposal.",
      "observedEntries": 1,
      "resolvedPath": "/Users/amichne/code/examplar/hooks",
      "retirementState": "COVERED_NO_REPLACEMENT_PLAN",
      "role": "local-repo-source",
      "sourcePath": "../examplar/hooks",
      "sourceRoot": "examplar-hooks",
      "type": "SOURCE_ROOT_RETIREMENT_ENTRY"
    },
    {
      "approvalSummary": {
        "alreadyActive": 0,
        "blocked": 0,
        "dependencyMapped": 0,
        "readyForApproval": 0,
        "readyForManualImport": 0,
        "reviewRequired": 0,
        "type": "SOURCE_ROOT_APPROVAL_SUMMARY"
      },
      "cleanupSummary": {
        "approved": 0,
        "executed": 3,
        "proposed": 0,
        "type": "SOURCE_ROOT_CLEANUP_SUMMARY"
      },
      "decisionSummary": {
        "digestCoveredByCanonical": 0,
        "digestRetainedExternal": 0,
        "rootPromoteCandidates": 0,
        "rootRetainedExternal": 0,
        "rootReviewRequired": 0,
        "sourceCoveredByCanonical": 3,
        "sourceKeepCanonical": 0,
        "sourceRetainedExternal": 0,
        "type": "SOURCE_ROOT_DECISION_SUMMARY"
      },
      "evidence": [
        "manifests/discovered-primitives.json records entries for sourceRoot examplar-skills.",
        "manifests/source-review-decisions.json and manifests/digest-review-decisions.json record covered=3 and retained=0 review groups.",
        "manifests/cleanup-ledger.json and manifests/runtime-activation-approvals.json record proposed=0, executed=3, readyForApproval=0, reviewRequired=0, dependencyMapped=0."
      ],
      "nextAction": "Decide whether this covered source should stay as provenance or receive a cleanup-ledger replacement proposal.",
      "observedEntries": 3,
      "resolvedPath": "/Users/amichne/code/examplar/skills",
      "retirementState": "COVERED_NO_REPLACEMENT_PLAN",
      "role": "local-repo-source",
      "sourcePath": "../examplar/skills",
      "sourceRoot": "examplar-skills",
      "type": "SOURCE_ROOT_RETIREMENT_ENTRY"
    },
    {
      "approvalSummary": {
        "alreadyActive": 0,
        "blocked": 0,
        "dependencyMapped": 0,
        "readyForApproval": 0,
        "readyForManualImport": 0,
        "reviewRequired": 0,
        "type": "SOURCE_ROOT_APPROVAL_SUMMARY"
      },
      "cleanupSummary": {
        "approved": 0,
        "executed": 0,
        "proposed": 0,
        "type": "SOURCE_ROOT_CLEANUP_SUMMARY"
      },
      "decisionSummary": {
        "digestCoveredByCanonical": 0,
        "digestRetainedExternal": 0,
        "rootPromoteCandidates": 0,
        "rootRetainedExternal": 0,
        "rootReviewRequired": 0,
        "sourceCoveredByCanonical": 0,
        "sourceKeepCanonical": 0,
        "sourceRetainedExternal": 0,
        "type": "SOURCE_ROOT_DECISION_SUMMARY"
      },
      "evidence": [
        "manifests/discovered-primitives.json records entries for sourceRoot apollo-plugins.",
        "manifests/source-review-decisions.json and manifests/digest-review-decisions.json record covered=0 and retained=0 review groups.",